2026-04-12T21:00:32.448164,41.748,32161,3279,True,1,"{""user_information"": {""weight"": ""75 kg"", ""height"": ""1.65 m"", ""diet"": ""Non-Veg"", ""usual_meal_times"": {""breakfast"": ""7:00 AM ET"", ""lunch"": ""12:30 PM ET"", ""dinner"": ""7:00 PM ET""}, ""oral_medication"": ""pre-meal"", ""insulin"": ""yes"", ""long acting Insulin"": ""Yes, every night 9PM ET"", ""glp1"": ""yes""}, ""current_glucose"": 165, ""max_predicted_glucose"": 205, ""min_predicted_glucose"": 88, ""last_meal"": ""Breakfast at 7:00 AM ET"", ""current_time"": ""1:30 PM ET"", ""has_meal_taken_around_current_time"": false, ""glucose_outlook"": ""Your past CGM readings show fluctuations (min: 90, max: 200). Your current glucose is 165 mg/dL. Over the next hour, your glucose is predicted to range between 88 mg/dL and 205 mg/dL, with some fluctuations above your target range of 90-150 mg/dL. It's important to take action to bring it back into range. Past glucose over 24 hours: [95, 156, 184, 175, 191, 125, 190, 188, 100, 92, 128, 129, 95, 125, 199, 173, 111, 90, 142, 186, 164, 155, 115, 152]. Predicted glucose for the next hour: [88, 140, 157, 187, 144, 137, 127, 152, 187, 117, 205, 100]."", ""medication_recommendation"": ""You have pre-meal oral medication, insulin, and GLP-1 agonist due before lunch. Please take them now."", ""meal_recommendation"": ""Since your glucose is currently elevated at 165 mg/dL, it's recommended to drink 500mL - 1L of water to help with hydration and potentially lower blood glucose. For lunch, focus on protein and vegetables: CHICKEN BREAST (56g | Protein: 21.4g | Carbs: 0g | Calories: 107 kcal) and BROCCOLI (85g | Carbs: 4.71g | Calories: 24 kcal). We are withholding carbohydrates to avoid further increasing your blood glucose. This meal is estimated to cause a 15-25 mg/dL change, bringing your blood glucose to approximately 180-190 mg/dL. Please monitor your glucose levels closely."", ""insulin_recommendation"": {""units"": 2, ""timing"": ""before lunch""}, ""exercise_recommendation"": ""Your current glucose level is 165 mg/dL, which is acceptable for exercise. To help bring your glucose down to your target range of 90-150 mg/dL, engage in moderate-intensity aerobic exercises for 30-60 minutes. Options include brisk walking (3.5-4.4 mph), cycling (10-14 mph), swimming, or elliptical training. Monitor your glucose levels after exercise."", ""safety_notes"": ""Continue to monitor your glucose levels closely, especially after meals and exercise. If your glucose remains high, consider drinking more water. Remember to not exercise if your glucose is below 70 mg/dL.""}"
2026-04-12T21:03:03.176787,33.655,14488,1810,True,1,"{""user_information"": {""weight"": ""75 kg"", ""height"": ""1.65 m"", ""diet"": ""Non-Veg"", ""usual_meal_times"": {""breakfast"": ""7:00 AM ET"", ""lunch"": ""12:30 PM ET"", ""dinner"": ""7:00 PM ET""}, ""oral_medication"": ""pre-meal"", ""insulin"": ""yes"", ""long acting Insulin"": ""Yes, every night 9PM ET"", ""glp1"": ""yes""}, ""current_glucose"": 180, ""max_predicted_glucose"": 209, ""min_predicted_glucose"": 105, ""last_meal"": ""Lunch at 1:00 PM ET"", ""current_time"": ""1:30 PM ET"", ""has_meal_taken_around_current_time"": true, ""glucose_outlook"": ""Your blood glucose was between 90-200 mg/dL over the past 24 hours. Currently, it is 180 mg/dL. Over the next hour, your glucose is predicted to range between 105-209 mg/dL."", ""medication_recommendation"": ""No immediate medication adjustments are recommended at this time. Remember to take your long-acting insulin at 9:00 PM ET."", ""meal_recommendation"": ""You recently had lunch. Please ensure adequate hydration. Consider drinking water."", ""insulin_recommendation"": {""units"": 0, ""timing"": ""not required""}, ""exercise_recommendation"": ""Your current glucose level is 180 mg/dL, and it's predicted to rise to 209 mg/dL. To help lower your blood glucose, I recommend engaging in moderate-intensity aerobic exercises like brisk walking (5.6\u20136.3 km/h), cycling (around 16 km/h), swimming, or elliptical training. Remember to listen to your body and adjust the intensity or duration as needed."", ""safety_notes"": ""Your current blood glucose of 180 mg/dL is above the target range of 90-150 mg/dL, and it is predicted to further rise to 209 mg/dL. While moderate exercise is recommended, please monitor your glucose closely.""}"
2026-04-12T22:20:23.781381,38.543,34615,3058,True,1,"{""user_information"": {""weight"": ""75 kg"", ""height"": ""1.65 m"", ""diet"": ""Non-Veg"", ""usual_meal_times"": {""breakfast"": ""7:00 AM ET"", ""lunch"": ""12:30 PM ET"", ""dinner"": ""7:00 PM ET""}, ""oral_medication"": ""pre-meal"", ""insulin"": ""yes"", ""long acting Insulin"": ""Yes, every night 9PM ET"", ""glp1"": ""yes""}, ""current_glucose"": 165, ""max_predicted_glucose"": 196, ""min_predicted_glucose"": 77, ""last_meal"": ""Breakfast at 7:00 AM ET"", ""current_time"": ""1:30 PM ET"", ""has_meal_taken_around_current_time"": false, ""glucose_outlook"": ""Your past CGM readings ranged from 90 to 200 mg/dL. Your current glucose is 165 mg/dL. Over the next hour, your glucose is predicted to range between 77 and 196 mg/dL. Predicted glucose at 5-minute intervals: [101, 91, 104, 188, 90, 196, 110, 116, 91, 77, 83, 143] mg/dL."", ""medication_recommendation"": ""ALERT: It's 1:30 PM ET. You need to take your pre-meal oral medication and insulin before lunch."", ""meal_recommendation"": ""Hydration: Drink 1L of water to help lower blood glucose.\n\nMeal Recommendation (Lunch):\nProtein: CHICKEN BREAST \u2014 284g | Protein: 20.4g | Carbs: 1.06g | Calories: 165 kcal\nVegetables: BROCCOLI \u2014 85g | Carbs: 4.71g | Calories: 24 kcal\nCarbohydrates: None: glucose above target range, carbohydrates withheld\n\nEstimated Total Carbohydrates: 5.77 grams\nEstimated glucose impact: This meal provides an expected 17-29 mg/dL change, bringing blood glucose to approximately 182-194 mg/dL.\n\nAdditional Guidance: Monitor your glucose levels closely."", ""insulin_recommendation"": {""units"": 2, ""timing"": ""before meal""}, ""exercise_recommendation"": ""Your current glucose level (165 mg/dL) is suitable for exercise. To help bring your glucose down, consider:\n*   **Walking:** A brisk walk (around 4.5\u20135.5 km/h or 2.8\u20133.4 mph) for 30-60 minutes.\n*   **Cycling:** Cycling at a moderate pace (around 16\u201319 km/h or 10\u201312 mph) for 30-45 minutes.\n*   **Strength Training:** Moderate-intensity strength training exercises for 30-45 minutes."", ""safety_notes"": ""Monitor your glucose levels closely. If glucose remains above 180 mg/dL after the meal, consider drinking more water. Avoid exercise if glucose falls below 70 mg/dL.""}"
2026-04-19T21:47:07Z,98.732,88300,5825,True,2,"{""user_information"": {""weight"": ""75 kg"", ""height"": ""1.65 m"", ""diet"": ""Non-Veg"", ""usual_meal_times"": {""breakfast"": ""7:00 AM ET"", ""lunch"": ""12:30 PM ET"", ""dinner"": ""7:00 PM ET""}, ""oral_medication"": ""pre-meal"", ""insulin"": ""yes"", ""long acting Insulin"": ""Yes, every night 9PM ET"", ""glp1"": ""Yes, weekly on Saturdays"", ""row_number"": 0}, ""current_glucose"": 165, ""glucose_at_meal_time"": 165, ""glucose_at_meal_time_source"": ""current"", ""max_predicted_glucose"": 192.1, ""min_predicted_glucose"": 160.5, ""future_cgm_4_points"": [160.5, 174.7, 184.1, 192.1], ""last_meal"": ""Breakfast at 7:00 AM ET"", ""current_time"": ""1:30 PM ET"", ""minutes_since_last_meal"": 390, ""has_meal_taken_around_current_time"": false, ""carb_rule"": ""HIGH"", ""meal_carbs_estimate"": 5.77, ""meal_carbs_estimate_note"": null, ""glucose_outlook"": ""High and stable"", ""medication_recommendation"": ""It is 1:30 PM ET. Your lunch was scheduled for 12:30 PM ET. If you have not yet taken your pre-meal oral medication, 2 units of short-acting insulin, and GLP-1 agonist (weekly dose \u2014 today, Saturday, is your scheduled injection day) and are about to eat, please take it now before your meal. If you have already taken your medication, no action is needed."", ""meal_recommendation"": ""The first result for \""broccoli\"" is suitable: \""BROCCOLI\"" with 4.71g carbs per 85g serving.\n\nNow I will construct the response.\nDiet Preference: Non-Veg\nGlucose Status: High\nHydration Recommendation: Drink water. Aim for 500mL - 1L of water to help manage high glucose levels.\nMeal Recommendation (Lunch):\nProtein: CHICKEN BREAST \u2014 284g | Protein: 20.4g | Carbs: 1.06g | Calories: 165 kcal\nVegetables: BROCCOLI \u2014 85g | Carbs: 4.71g | Calories: 24 kcal\nCarbohydrates: None (intentional) \u2014 approximately 5.77g naturally occurring carbs from protein and vegetables only. No grain, bread, rice, fruit, or starchy carbs included.\nEstimated Total Carbohydrates: 5.77 grams\nAdditional Guidance: Recheck your glucose in 1-2 hours to monitor its trend."", ""insulin_recommendation"": {""units"": 2, ""timing"": ""before lunch""}, ""exercise_recommendation"": {""status"": ""ok"", ""max_intensity"": ""Vigorous"", ""exercise_credit_mgdl"": 0, ""intensity"": ""Light, Moderate, or Vigorous, based on preference and fitness level."", ""duration"": null, ""focus"": null, ""suggested_exercises"": ""Walking (very slow, <3.2 km/h / <2.0 mph, strolling), Calisthenics (light: core/plank/crunches), Stretching (mild), Pilates (mat / traditional), Yoga (general / hatha), Walking (moderate, ~4.5\u20135.5 km/h / 2.8\u20133.4 mph), Hiking (easy / slow, no load), Cycling (very easy, ~9 km/h / 5.5 mph), Weight training (multiple exercises, moderate volume), Strength training (compound lifts: squat/deadlift), Swimming backstroke (easy / recreational), Water aerobics (general), Tennis (doubles), Golf (walking, pulling clubs), Walking (very fast, ~7.2\u20137.9 km/h / 4.5\u20134.9 mph), Running (easy, ~8:05 min/km / 13:00 min/mile, ~6.4 km/h / 4.0 mph), Cycling (moderate, 19\u201322 km/h / 12\u201314 mph), Mountain biking (general), Calisthenics (vigorous: burpees/jacks/ropes), Aerobics (general), Swimming freestyle (medium pace), Water aerobics (high intensity), Tennis (singles), Basketball (game), Soccer (casual / general), Ice hockey (general)."", ""pre_meal_strategy"": null, ""safety_note"": ""Your glucose level is 165 mg/dL. It's okay to exercise, but be aware that your blood sugar may rise if you do strength training or high-intensity interval training. Remember to listen to your body and stop if you feel any discomfort.""}, ""safety_notes"": null}"
2026-04-19T21:52:07Z,201.476,21650,1786,True,2,"{""user_information"": {""weight"": ""75 kg"", ""height"": ""1.65 m"", ""diet"": ""Non-Veg"", ""usual_meal_times"": {""breakfast"": ""7:00 AM ET"", ""lunch"": ""12:30 PM ET"", ""dinner"": ""7:00 PM ET""}, ""oral_medication"": ""pre-meal"", ""insulin"": ""yes"", ""long acting Insulin"": ""Yes, every night 9PM ET"", ""glp1"": ""Yes, weekly on Saturdays"", ""row_number"": 0}, ""current_glucose"": 165, ""glucose_at_meal_time"": 165, ""glucose_at_meal_time_source"": ""current"", ""max_predicted_glucose"": 165, ""min_predicted_glucose"": 165, ""future_cgm_4_points"": [165, 165, 165, 165], ""last_meal"": ""Breakfast at 7:00 AM ET"", ""current_time"": ""1:30 PM ET"", ""minutes_since_last_meal"": 390, ""has_meal_taken_around_current_time"": false, ""carb_rule"": ""HIGH"", ""meal_carbs_estimate"": 0, ""meal_carbs_estimate_note"": null, ""glucose_outlook"": ""Expected to remain high."", ""medication_recommendation"": ""It is Saturday, so remember to take your weekly GLP-1 medication. If you plan to have a meal, remember to take your pre-meal oral medication as prescribed."", ""meal_recommendation"": ""hydration only"", ""insulin_recommendation"": {""units"": 0, ""timing"": ""not required""}, ""exercise_recommendation"": {""status"": ""ok"", ""max_intensity"": ""Moderate"", ""exercise_credit_mgdl"": 0, ""intensity"": ""light to moderate"", ""duration"": ""30 minutes"", ""focus"": ""cardio"", ""suggested_exercises"": ""Walking, light cycling"", ""pre_meal_strategy"": null, ""safety_note"": ""Monitor glucose levels before and after exercise.""}, ""safety_notes"": ""It is important to manage high blood glucose. Follow recommendations for hydration and medication.""}"
2026-04-19T21:56:53Z,73.221,88576,3496,True,1,"{""user_information"": {""weight"": ""75 kg"", ""height"": ""1.65 m"", ""diet"": ""Non-Veg"", ""usual_meal_times"": {""breakfast"": ""7:00 AM ET"", ""lunch"": ""12:30 PM ET"", ""dinner"": ""7:00 PM ET""}, ""oral_medication"": ""pre-meal"", ""insulin"": ""yes"", ""long acting Insulin"": ""Yes, every night 9PM ET"", ""glp1"": ""Yes, weekly on Saturdays"", ""row_number"": 2405}, ""current_glucose"": 165, ""glucose_at_meal_time"": 165, ""glucose_at_meal_time_source"": ""current"", ""max_predicted_glucose"": 179.2, ""min_predicted_glucose"": 163.7, ""future_cgm_4_points"": [163.7, 170.6, 179.2, 178.5], ""last_meal"": ""Breakfast at 7:00 AM ET"", ""current_time"": ""1:30 PM ET"", ""minutes_since_last_meal"": 390, ""has_meal_taken_around_current_time"": false, ""carb_rule"": ""HIGH"", ""meal_carbs_estimate"": 4.59, ""meal_carbs_estimate_note"": null, ""glucose_outlook"": ""Your glucose is currently high at 165 mg/dL. It is predicted to remain high, ranging between 163.7 mg/dL and 179.2 mg/dL over the next 60 minutes."", ""medication_recommendation"": ""It is 1:30 PM ET. Your lunch was scheduled for 12:30 PM ET. If you have not yet taken your pre-meal oral medication, short-acting insulin, and GLP-1 agonist (weekly dose \u2014 today, Saturday, is your scheduled injection day) and are about to eat, please take it now before your meal. If you have already taken your medication, no action is needed."", ""meal_recommendation"": ""Diet Preference: Non-Veg\n\nGlucose Status: High\n\nHydration Recommendation:\n1 L of water\n\nMeal Recommendation (Lunch):\n\nProtein:\nCHICKEN BREAST \u2014 284g | Protein: 20.4g | \nCarbs: 1.06g | Calories: 165 kcal\n\nVegetables:\nASPARAGUS \u2014 85g | Carbs: 3.53g | \nCalories: 18 kcal\n\nCarbohydrates:\nNone (intentional) \u2014 approximately 4.59g naturally occurring carbs from protein and vegetables only.\nNo grain, bread, rice, fruit, or starchy carbs included.\n\nEstimated Total Carbohydrates: 4.59 grams\n\nAdditional Guidance:\nYour glucose level is currently high. Focus on a meal rich in protein and vegetables."", ""insulin_recommendation"": {""units"": 2, ""timing"": ""before meal""}, ""exercise_recommendation"": {""status"": ""ok"", ""max_intensity"": ""Moderate"", ""exercise_credit_mgdl"": 0, ""intensity"": ""Light to Moderate"", ""duration"": ""30-60 minutes"", ""focus"": ""Sustained aerobic activities"", ""suggested_exercises"": ""Walking, Cycling, Water Aerobics, Light Strength Training"", ""pre_meal_strategy"": null, ""safety_note"": ""Monitor glucose levels closely, especially if trying new or more intense activity. If you feel any discomfort, stop exercising. Hydrate adequately.""}, ""safety_notes"": null}"
